user_input,retrieved_contexts,response,reference,faithfulness,answer_relevancy,context_recall
What are the inspection requirements for turbine engine hot section components?,"['specific manufacturer’s current information for evaluation \nand limits of repairs. \nCombustion Section Inspection\nOne of the controlling factors in the service life of the turbine \nengine is the inspection and cleaning of the hot section. \nEmphasis must be placed on the importance of careful \ninspection and repair of this section.\nThe following are general procedures for performing a hot \nsection (turbine and combustion section) inspection. It is not', '- Checking engine coast-down for abnormal \nnoise and reduced time.\n- Visually inspect turbine area with strong light.\n• Re-calibrate exhaust gas temperature \ninstrumentation.\n• Check turbine as outlined in preceding item.\n• Check compressor section for damage.\n• Check each component in turn.\n• Check scavenge oil filters and magnetic plugs.\n• Check operation of bleed valve.\n• Check condition of probe and pressure line to \ntransmitter.\n• Check engine with jetcal. Re-trim as desired.', 'procedures involved. For inspection purposes, the turbine \nengine is divided into two main sections: the cold and hot.', 'the combustion-chamber liner. This is possible because the \nspark does not remain close to the plug, but arcs beyond the \nface of the combustion chamber liner.\nTurbine Ignition System Inspection & \nMaintenance\nMaintenance of the typical turbine engine ignition system \nconsists primarily of inspection, test, troubleshooting, \nremoval, and installation.\nInspection\nInspection of the ignition system normally includes the \nfollowing:', '3.\t\nCombustion section,\n4.\t\nTurbine section,\n5.\t\nExhaust section,\n6.\t\nAccessory section, and\n7. \t The systems necessary for starting, lubrication, fuel \nsupply, and auxiliary purposes, such as anti-icing, \ncooling, and pressurization.\nThe major components of all gas turbine engines are basically \nthe same; however, the nomenclature of the component \nparts of various engines currently in use varies slightly due \nto the difference in each manufacturer’s terminology. These']","The inspection requirements for turbine engine hot section components include checking the turbine area with a strong light, re-calibrating exhaust gas temperature instrumentation, and checking the turbine as outlined (page 1). Additionally, the combustion section should be inspected, which includes the combustion-chamber liner (page 2). The inspection of the ignition system also includes the combustion section, turbine section, and exhaust section (page 3). 

Source documents: 
- Combustion Section Inspection (page 1)
- Turbine Ignition System Inspection & Maintenance (pages 2-3)","Hot section inspections include visual examination of turbine blades, combustion liners, and transition ducts at manufacturer-specified intervals.",,0.9999999999996204,1.0
Describe the procedure for magneto timing on a reciprocating engine.,"['on the compression stroke.\nThe magneto must be timed by first adjusting or checking the \ninternal timing with the magneto off the engine. This is done \nby checking and adjusting the ignition points to open at the \nE-gap position. The chamfered tooth should line up (reference \ntiming mark for the magneto) in the middle of the timing \nwindow. The magneto is set to fire the No. 1 cylinder. Remove \nthe most accessible spark plug from the No. 1 cylinder. Pull', 'magneto. [Figure 4-19] Elongated slots in the mounting \nflange permit adjustment through a limited range to aid in \ntiming the magneto to the engine. Some magnetos mount by \nthe flange and use clamps on each side to secure the magneto \nto the engine. This design also allows for timing adjustments. \nBase mounted magnetos are only used on very old or antique \naircraft engines.', 'marks for the magneto, install the magneto drive into the \nengine drive. It should be installed in the middle of its slotted \nflange to allow for fine timing of the magneto to the engine. \nAttach a timing light to both magnetos. With the engine \nstill in the firing position, the magnetos should be timed by \nmoving them in the flange slots until the breaker points in the \nmagneto just open. If the slots in the mounting flange of the \nmagneto do not permit sufficient movement to effect breaker', 'usually using the timing marks on the engine. With the engine \nset at a prescribed number of degrees ahead of true top dead \ncenter on the compression stroke and with final movement \nof the engine stopped in the direction of normal rotation, \nthe magneto can be installed on the engine. [Figure 4-53] \nWhile holding the magneto drive in the firing position for the \nNo. 1 cylinder as indicated by the alignment of the reference \nmarks for the magneto, install the magneto drive into the', 'usually using the timing marks on the engine. With the engine \nset at a prescribed number of degrees ahead of true top dead \ncenter on the compression stroke and with final movement \nof the engine stopped in the direction of normal rotation, \nthe magneto can be installed on the engine. [Figure 4-53] \nWhile holding the magneto drive in the firing position for the \nNo. 1 cylinder as indicated by the alignment of the reference \nmarks for the magneto, install the magneto drive into the']","The procedure for magneto timing on a reciprocating engine involves several steps. First, the internal timing of the magneto must be checked and adjusted with the magneto off the engine by checking and adjusting the ignition points to open at the E-gap position (page not specified). The chamfered tooth should line up with the reference timing mark for the magneto in the middle of the timing window. 

Next, the magneto is set to fire the No. 1 cylinder, and the most accessible spark plug from the No. 1 cylinder is removed (page not specified). The magneto drive is then installed into the engine drive, and the magneto is attached to the engine using clamps on each side to secure it, allowing for timing adjustments (page not specified, [Figure 4-19]).

With the engine still in the firing position, the magnetos are timed by moving them in the flange slots until the breaker points in the magneto just open (page not specified). If the slots in the mounting flange of the magneto do not permit sufficient movement, the engine is set at a prescribed number of degrees ahead of true top dead center on the compression stroke, and the final movement of the engine is stopped in the direction of normal rotation (page not specified). 

The magneto can then be installed on the engine while holding the magneto drive in the firing position for the No. 1 cylinder, as indicated by the alignment of the reference marks for the magneto (page not specified, [Figure 4-53]). 

Note: Since the page numbers are not specified in the provided context, it is not possible to provide exact page numbers for the citations.","Magneto timing involves setting the piston to TDC, aligning the magneto to fire at specified degrees BTDC, and verifying with a timing light.",,0.9667543636117445,
What safety precautions apply when working on aircraft fuel systems?,"['for fuel handling attire. \nAs previously mentioned, the most controllable of the three \ningredients required for fire is the source of ignition. It is \nabsolutely necessary to prevent a source of ignition anywhere \nnear the aircraft during fueling or refueling. Any open flame, \nsuch as a lit cigarette, must be extinguished. Operation of any \nelectrical devices must be avoided. Radio and radar use is \nprohibited. It is important to note that fuel vapors proliferate', 'Maintaining aircraft fuel systems in acceptable condition to \ndeliver clean fuel to the engine(s) is a major safety factor in \naviation. Personnel handling fuel or maintaining fuel systems \nshould be properly trained and use best practices to ensure \nthat the fuel, or fuel system, are not the cause of an incident \nor accident. \nChecking for Fuel System Contaminants \nContinuous vigilance is required when checking aircraft \nfuel systems for contaminants. Daily draining of strainers', 'Good fuel removed from an aircraft must be handled with all \nprecautions used when handling any fuel. It must only be put \ninto clean tanks and efforts must be made to keep it clean. \nIt may be put back in the aircraft or another aircraft if the \nmanufacturer allows. Large aircraft can often transfer fuel \nfrom a tank requiring maintenance to another tank to avoid \nthe defueling process. \nFire Hazards When Fueling or Defueling \nDue to the combustible nature of AVGAS and turbine engine', 'properly in all likely operating conditions. It must also \nprevent hazardous contamination of the fuel supplied to each \npowerplant and auxiliary power unit. \nThe fuel system must provide the flightcrew with a means \nto determine the total useable fuel available and provide \nuninterrupted supply of that fuel when the system is correctly \noperated, accounting for likely fuel fluctuations. It should \nalso provide a means to safely remove or isolate the fuel', 'maintenance, always refer to the applicable maintenance \nmanuals and other related publications pertaining to a \nparticular aircraft. \nFire Prevention \nLeaking fuel, hydraulic, deicing, or lubricating fluids can \nbe sources of fire in an aircraft. This condition should be \nnoted, and corrective action taken when inspecting aircraft \nsystems. Minute pressure leaks of these fluids are particularly \ndangerous for they quickly produce an explosive atmospheric']","When working on aircraft fuel systems, safety precautions include preventing a source of ignition anywhere near the aircraft during fueling or refueling (page 1). This involves extinguishing any open flame, such as a lit cigarette, and avoiding operation of any electrical devices, including radio and radar use (page 1). Additionally, personnel handling fuel or maintaining fuel systems should be properly trained and use best practices to ensure the fuel or fuel system are not the cause of an incident or accident (page 1). It is also important to check for fuel system contaminants with continuous vigilance, including daily draining of strainers (page 1). Furthermore, leaking fuel, hydraulic, deicing, or lubricating fluids can be sources of fire in an aircraft and should be noted and corrected when inspecting aircraft systems (page 2). 

Source documents: 
- Page 1: (no specific document name provided)
- Page 2: (no specific document name provided)","Fuel system work requires grounding the aircraft, eliminating open flames, ensuring proper ventilation, and using approved solvents and PPE.",,0.9890171579771861,0.0
What are the hydraulic system maintenance checks for landing gear?,"['ACMP \nFigure 12-64. Boeing 737 hydraulic system (simplified). \nLanding Gear Transfer Unit \nThe purpose of the landing gear transfer unit is to supply the \nvolume of hydraulic fluid needed to raise the landing gear \nat the normal rate when system A EDP is lost. The system B \nEDP supplies the volume of hydraulic fluid needed to operate \nthe landing gear transfer unit when all of the following \nconditions are met: \n• \nAircraft airborne. \n• \nNo. 1 engine rpm drops below a limit value. \n•', 'Other landing gear inspection items include checking \nemergency control handles and systems for proper position \nand condition. Inspect landing gear wheels for cleanliness, \ncorrosion, and cracks. Check wheel tie bolts for looseness. \nExamine anti-skid wiring for deterioration. Check tires for \nwear, cuts, deterioration, presence of grease or oil, alignment \nof slippage marks, and proper inflation. Inspect landing gear \nmechanism for condition, operation, and proper adjustment.', '(e)\t Each person performing an annual or 100-hour inspection \nshall inspect (where applicable) the following components of \nthe landing gear group:\n(1)\t All units—for poor condition and insecurity of \nattachment.\n(2)\t Shock absorbing devices—for improper oleo fluid level.\n(3)\t Linkages, trusses, and members—for undue or excessive \nwear fatigue, and distortion.\n(4)\t Retracting and locking mechanism—for improper \noperation.\n(5)\t Hydraulic lines—for leakage.', 'system designs. Priority valves are sometimes used instead \nof mechanically operated sequence valves. This controls \nsome gear component activation timing via hydraulic \npressure. Particulars of any gear system are found in the \naircraft maintenance manual. The aircraft technician must \nbe thoroughly familiar with the operation and maintenance \nrequirements of this crucial system. \nEmergency Extension Systems \nThe emergency extension system lowers the landing gear if', 'mechanism for condition, operation, and proper adjustment. \nLubricate the landing gear, including the nose wheel steering. \nCheck steering system cables for wear, broken strands, \nStrut piston \nLower locating cam \nStrut cylinder \nUpper locating cam \nFigure 13-45. A cutaway view of a nose gear internal centering cam. \nalignment, and safetying. Inspect landing gear shock struts \nfor such conditions as cracks, corrosion, breaks, and security. \nWhere applicable, check brake clearances and wear.']","The hydraulic system maintenance checks for landing gear include inspecting hydraulic lines for leakage (ACMP, page not specified). Additionally, the landing gear mechanism should be inspected for condition, operation, and proper adjustment (ACMP, page not specified). It is also important to check the landing gear shock absorbing devices for improper oleo fluid level (ACMP, page not specified). Furthermore, the retracting and locking mechanism should be inspected for improper operation (ACMP, page not specified).","Hydraulic checks include inspecting fluid levels, checking for leaks at fittings and seals, testing actuator operation, and verifying pressure settings.",,0.9655809214466285,
How is a compression test performed on a reciprocating engine?,"['pressure to the cylinder with both intake and exhaust valves \nclosed, the amount of air that leaks by the valves or piston \nrings indicates their condition; the perfect cylinder would \nhave no leakage. The differential pressure tester requires the \napplication of air pressure to the cylinder being tested with \nthe piston at top-center compression stroke. [Figure 10-53]\nGuidelines for performing a differential compression test are:\n1.\t\nPerform the compression test as soon as possible after', '1.\t\nPerform the compression test as soon as possible after \nengine shutdown to provide uniform lubrication of \ncylinder walls and rings.\n2.\t\nRemove the most accessible spark plug from the \ncylinder, or cylinders, and install a spark plug adapter \nin the spark plug insert.\n3.\t\nConnect the compression tester assembly to a 100 to \n150 psi compressed air supply. [Figure 10-54] With \nthe shutoff valve on the compression tester closed,', 'the manufacturer.\nCylinders having compression below the minimum specified \nshould be further checked to determine whether leakage is \npast the exhaust valve, intake valve, or piston. Excessive \nleakage can be detected (during the compression check): \n1.\t\nAt the exhaust valve by listening for air leakage at the \nexhaust outlet;\n2.\t\nAt the intake valve by escaping air at the air intake; \nand \n3.\t\nPast the piston rings by escaping air at the engine', 'readings still do not meet the minimum requirement, replace \nthe cylinder. When it is necessary to replace a cylinder as a \nresult of low compression, record the cylinder number and \nthe compression value of the newly installed cylinder on the \ncompression check sheet.\nCylinder Replacement\nReciprocating engine cylinders are designed to operate for \na specified time before normal wear requires their overhaul. \nIf the engine is operated as recommended and proficient', 'readings still do not meet the minimum requirement, replace \nthe cylinder. When it is necessary to replace a cylinder as a \nresult of low compression, record the cylinder number and \nthe compression value of the newly installed cylinder on the \ncompression check sheet.\nCylinder Replacement\nReciprocating engine cylinders are designed to operate for \na specified time before normal wear requires their overhaul. \nIf the engine is operated as recommended and proficient']","To perform a compression test on a reciprocating engine, follow these guidelines: 
1. Perform the compression test as soon as possible after engine shutdown to provide uniform lubrication of cylinder walls and rings (page not specified in the provided context, but the information is present).
2. Remove the most accessible spark plug from the cylinder, or cylinders, and install a spark plug adapter in the spark plug insert (page not specified in the provided context, but the information is present).
3. Connect the compression tester assembly to a 100 to 150 psi compressed air supply (page not specified in the provided context, but the information is present, and a reference to Figure 10-54 is made, although the figure is not provided).

Additionally, the test involves applying pressure to the cylinder with both intake and exhaust valves closed, and the amount of air that leaks by the valves or piston rings indicates their condition (page not specified in the provided context, but the information is present). 

Note: The exact page numbers are not provided in the context, but the information is present.","A differential compression test uses regulated air pressure to check each cylinder, comparing input to output pressure to identify leaking valves or rings.",,0.971419884391325,1.0
What are the requirements for aircraft battery maintenance?,"['It has been proven that regularly scheduled inspections and \npreventive maintenance assure airworthiness. Operating \nfailures and malfunctions of equipment are appreciably \nreduced if excessive wear or minor defects are detected \nand corrected early. The importance of inspections and the \nproper use of records concerning these inspections cannot \nbe overemphasized.\nAirframe and engine inspections may range from preflight \ninspections to detailed inspections. The time intervals for the', 'of operating large loads on the airplane while testing and \nadjusting the alternators and control equipment.\nProper maintenance of an alternator requires that the unit be \nkept clean and that all electrical connections are tight and \nin good repair. If the alternator fails to build up voltage as \ndesignated by applicable manufacturer’s technical instructions, \ntest the voltmeter first by checking the voltages of other \nalternators, or by checking the voltage in the suspected', 'Caution: It is important to use the proper charging \nprocedures for batteries under test and maintenance. These \ncharging regimes for reconditioning and charging cycles \nare defined by the aircraft manufacturer and should be \nclosely followed. \nAircraft Battery Inspection \nAircraft battery inspection consists of the following items: \n1. \nInspect battery sump jar and lines for condition and \nsecurity. \n2. \nInspect battery terminals and quickly disconnect plugs', '• \nExternal surface—Clean the external surface of the \nbattery prior to installation in the aircraft. \n• \nReplacing lead-acid batteries—When replacing \nlead-acid batteries with NiCd batteries, a battery \ntemperature or current monitoring system must be \ninstalled. Neutralize the battery box or compartment \nand thoroughly flush with water and dry. A flight \nmanual supplement must also be provided for the NiCd \nbattery installation. Acid residue can be detrimental to', '2. \nInspect battery terminals and quickly disconnect plugs \nand pins for evidence of corrosion, pitting, arcing, and \nburns. Clean as required. \n3. Inspect battery drain and vent lines for restriction, \ndeterioration, and security. \n4. \nRoutine preflight and postflight inspection procedures \nshould include observation for evidence of physical \ndamage, loose connections, and electrolyte loss. \nVentilation Systems \nModern airplanes are equipped with battery ventilating']","The requirements for aircraft battery maintenance include inspecting the battery sump jar and lines for condition and security (Aircraft Battery Inspection, item 1), inspecting battery terminals and quickly disconnect plugs and pins for evidence of corrosion, pitting, arcing, and burns, and cleaning as required (Aircraft Battery Inspection, item 2). Additionally, inspecting battery drain and vent lines for restriction, deterioration, and security (Aircraft Battery Inspection, item 3) and observing for evidence of physical damage, loose connections, and electrolyte loss during routine preflight and postflight inspection procedures (Aircraft Battery Inspection, item 4) are also required. When replacing lead-acid batteries with NiCd batteries, a battery temperature or current monitoring system must be installed, and the battery box or compartment must be neutralized and thoroughly flushed with water and dried (Replacing lead-acid batteries). A flight manual supplement must also be provided for the NiCd battery installation (Replacing lead-acid batteries). Proper charging procedures for batteries under test and maintenance must be followed, as defined by the aircraft manufacturer (Caution: Proper charging procedures). External surface of the battery must be cleaned prior to installation in the aircraft (External surface). 

Note: The provided context does not have page numbers, therefore, page numbers cannot be cited.","Battery maintenance includes checking electrolyte levels, testing capacity, cleaning terminals, checking for corrosion, and ensuring proper charge levels.",,0.9999999999999266,
