user_input,retrieved_contexts,response,reference,faithfulness,answer_relevancy,context_recall
Explain the process of bleeding aircraft brakes.,"['Master cylinder \nClear hose \nPressure pot \nBrake\nreservoir \nFigure 13-119. Arrangement for bottom-up pressure bleeding of \naircraft brakes. Fluid is pushed through the system until no air \nbubbles are visible in the hose at the top. \nbleed port on the brake assembly. The other end is submersed in \nclean fluid in a container large enough to capture fluid expelled \nduring the bleeding process. Depress the brake pedal and', 'brakes. The trapped air in the brake system would be forced \ninto the main hydraulic system, which is not acceptable. \nMany aircraft with power brake systems accept the \nconnection of an auxiliary hydraulic mule that can be used \nto establish pressure in the system for bleeding. Regardless, \nthe aircraft system must be pressurized to bleed power brake \nsystems. Attach a clear hose to the brake bleed port fitting on \nthe brake assembly and immerse the other end of the hose in', 'the brake assembly and immerse the other end of the hose in \na container of clean hydraulic fluid. With the bleeder valve \nopen, carefully apply the brake to allow aircraft hydraulic \nfluid to enter the brake system. The fluid expels the fluid \ncontaminated with air out of the bleed hose into the container. \nWhen air is no longer visible in the hose, close the bleed \nvalve and restore the hydraulic system to normal operation \nconfiguration. \nPower brake systems on different aircraft contain many', 'Master cylinder \nClear hose \nBrake\nreservoir \nFigure 13-120. Arrangement for top down or gravity bleeding of \naircraft brakes. \nno longer contains any air. Tighten the bleed port fitting and \nensure the reservoir is filled to the proper level. \nWhenever bleeding the brakes, ensure that reservoirs and \nbleed tanks remain full during the process. Use only clean, \nspecified fluid.Always check the brakes for proper operation, \nany leaks when bleeding is complete, and assure that the fluid', 'The brake is reassembled in the reverse order. Be certain to \ninclude any shims if required. The bolts holding the backplate \nto the cylinder assembly must be torqued according to \nmanufacturer specifications and safetied. The manufacturer’s \ndata also provides a burn in procedure. The aircraft is taxied \nat a specified speed, and the brakes are smoothly applied. \nAfter a cooling period, the process is repeated, thus preparing \nthe linings for service. \nBrake Malfunctions & Damage']","The process of bleeding aircraft brakes involves several steps to ensure that the brake system is free from air and functioning properly. According to the provided context, there are two methods of bleeding: bottom-up pressure bleeding (Figure 13-119) and top-down or gravity bleeding (Figure 13-120). 

For bottom-up pressure bleeding, a clear hose is attached to the brake bleed port fitting on the brake assembly and immersed in a container of clean hydraulic fluid (page not specified). The brake pedal is then depressed, allowing aircraft hydraulic fluid to enter the brake system and expel the fluid contaminated with air out of the bleed hose into the container (page not specified). 

For top-down or gravity bleeding, a similar process is used, with the clear hose attached to the brake bleed port fitting and immersed in a container of clean hydraulic fluid (Figure 13-120, page not specified). The fluid is allowed to flow through the system until no air bubbles are visible in the hose at the top (Figure 13-119, page not specified). 

In both cases, the bleeding process is complete when air is no longer visible in the hose, at which point the bleed valve is closed and the hydraulic system is restored to normal operation configuration (page not specified). It is also important to ensure that reservoirs and bleed tanks remain full during the process and to use only clean, specified fluid (page not specified). 

After bleeding is complete, the brakes should be checked for proper operation and any leaks, and the fluid level should be verified (page not specified). Additionally, if the brake was disassembled for maintenance, it should be reassembled in the reverse order, with any required shims and proper torquing and safetying of the bolts (page not specified). The manufacturer's data may also provide a burn-in procedure to prepare the linings for service (page not specified).",Brake bleeding removes air from hydraulic lines by opening bleeder valves while applying pressure until fluid flows without bubbles.,,0.9253134906264715,1.0
What NDT methods are used for aircraft structural inspection?,"['The inspection should begin with an examination of the \nexternal surface of the aircraft. This provides a general \nassessment of the overall condition of the wood and structure. \nThe wings, fuselage, and empennage should be inspected for \nundulation, warping, or any other disparity from the original \nshape. Where the wings, fuselage, or empennage structure \nand skins form stressed structures, no departure from the \noriginal contour or shape is permissible. [Figure 6-3]', 'out the more specific inspections. They are referred to as \nnondestructive inspection (NDI) or nondestructive testing \n(NDT). The objective of NDI and NDT is to determine the \nairworthiness of a component, without damaging it, that \nwould render it unairworthy. Some of these methods are \nsimple, requiring little additional expertise, while others are \nhighly sophisticated and require that the technician be highly \ntrained and specially certified.\n \nTraining, Qualification, & Certification', 'exposure to radiation.\nInspection of Composites\nComposite structures are inspected for delamination \n(separation of the various plies), debonding of the skin from \nthe core, and evidence of moisture and corrosion. Previously \ndiscussed methods including ultrasonic, acoustic emission, \nand radiographic inspections may be used as recommended \nby the aircraft manufacturer. The simplest method used in \ntesting composite structures is the tap test. Newer methods,', 'The penetrating radiation is projected through the part to be \ninspected and produces an invisible or latent image in the film. \nWhen processed, the film becomes a radiograph or shadow \npicture of the object. This inspection medium and portable \nunit provides a fast and reliable means for checking the \nintegrity of airframe structures and engines. [Figure 10-36]\nRadiographic Inspection\nRadiographic inspection techniques are used to locate \ndefects or flaws in airframe structures or engines with little', 'The penetrating radiation is projected through the part to be \ninspected and produces an invisible or latent image in the film. \nWhen processed, the film becomes a radiograph or shadow \npicture of the object. This inspection medium and portable \nunit provides a fast and reliable means for checking the \nintegrity of airframe structures and engines. [Figure 10-36]\nRadiographic Inspection\nRadiographic inspection techniques are used to locate \ndefects or flaws in airframe structures or engines with little']","The NDT methods used for aircraft structural inspection include ultrasonic, acoustic emission, and radiographic inspections, as recommended by the aircraft manufacturer (page not specified, as page numbers are not provided in the context). Additionally, the tap test is mentioned as a simple method used in testing composite structures (page not specified). Radiographic inspection techniques are also used to locate defects or flaws in airframe structures or engines (page not specified, but [Figure 10-36] is referenced). 

Note: Since page numbers are not provided in the context, it is not possible to provide a specific page number citation.","NDT methods include visual inspection, dye penetrant, magnetic particle, eddy current, ultrasonic testing, and radiographic inspection.",,0.0,0.0
What are the torque specifications and procedures for cylinder hold-down nuts?,"['cylinders. Careless work or the use of incorrect tools can \ndamage the replacement cylinder or its parts. Incorrect \nprocedures in installing rocker-box covers may result in \ntroublesome oil leaks. Improper torque on cylinder hold down \nnuts or cap-screws can easily result in a cylinder malfunction \nand subsequent engine failure.\nCylinder Removal\nSince these instructions are meant to cover all air-cooled \nengines, they are of a very general nature. The applicable', 'install two cap-screws or stud nuts 180° apart.\nInstall the remaining nuts or cap-screws and tighten them \nuntil they are snug. The hold down nuts, or cap-screws, must \nnow be torqued to the value specified in the table of torque', '10-43\nOIL\n5\n4\n300\n200\n0\n100\nFigure 10-55. Cold cylinder indicator. \nvalues in the engine manufacturer’s service or overhaul \nmanual. Apply the torque with a slow, steady motion until \nthe prescribed value is reached. Hold the tension on the \nwrench for a sufficient length of time to ensure that the nut \nor cap-screw tightens no more at the prescribed torque value. \nIn many cases, additional turning of the cap-screw, or nut, \nas much as one-quarter turn can be done by maintaining', 'hardware and realign the holes. The torque loads specified \nmay be used for all unlubricated cadmium-plated steel nuts \nof the fine or coarse thread series, which have approximately \nequal number of threads and equal face bearing areas. These \nvalues do not apply where special torque requirements are \nspecified in the maintenance manual.\nIf the head end, rather than the nut, must be turned in the \ntightening operation, maximum torque values may be', 'and bolts, and replace any in doubtful condition. During \nassembly, the nuts should be gradually and progressively \ntightened to the correct torque. The clamps should be tapped \nwith a rawhide mallet as they are being tightened to prevent \nbinding at any point. On some systems, a ball joint connects \nthe stationary portion of the exhaust system to the portion \nthat is attached to the engine. This ball joint absorbs the \nnormal engine movement caused by the unbalanced forces']","The torque specifications for cylinder hold-down nuts are to be found in the ""table of torque values in the engine manufacturer’s service or overhaul manual"" (page not specified). The procedure for torquing the hold-down nuts or cap-screws is as follows: 
1. Install two cap-screws or stud nuts 180° apart (no page specified).
2. Install the remaining nuts or cap-screws and tighten them until they are snug (no page specified).
3. Torque the hold-down nuts, or cap-screws, to the value specified in the table of torque values (page not specified).
4. Apply the torque with a slow, steady motion until the prescribed value is reached (page not specified).
5. Hold the tension on the wrench for a sufficient length of time to ensure that the nut or cap-screw tightens no more at the prescribed torque value (page not specified).

Additionally, the torque loads specified may be used for all unlubricated cadmium-plated steel nuts of the fine or coarse thread series (page not specified). 

Source document name and page number are not provided for the above information as it is not available in the given context.","Cylinder hold-down nuts are torqued in a cross pattern to manufacturer specifications, typically in multiple passes to ensure even seating.",,0.9453534195139671,1.0
How is aircraft corrosion treated and prevented?,"['Chemical cleaners must be used with great care in cleaning \nassembled aircraft. The danger of entrapping corrosive \nmaterials in faying surfaces and crevices counteracts any \nadvantages in their speed and effectiveness. Any materials \nused must be relatively neutral and easy to remove. It is \nemphasized that all residues must be removed. Soluble salts \nfrom chemical surface treatments, such as chromic acid or \ndichromate treatment, liquefy and promote blistering in the \npaint coatings.', 'obtain reliable results. \nIn addition to routine maintenance inspections, amphibians \nor seaplanes must be checked daily and critical areas cleaned \nor treated, as necessary.\nCorrosion Prone Areas\nDiscussed briefly in this section are most of the corrosion \nproblem areas common to all aircraft. These areas should \nbe cleaned, inspected, and treated more frequently than less \ncorrosion prone areas. This information is not necessarily \ncomplete and may be amplified and expanded to cover', 'of the aircraft and is usually performed after the surfaces have \nbeen cleaned. Polishing is also used to remove oxidation and \ncorrosion. Polishing materials are available in various forms \nand degrees of abrasiveness. It is important that the aircraft \nmanufacturer’s instructions be used in specific applications.\nThe washing of aircraft should be performed in the shade \nwhenever possible, as cleaning compounds tend to streak \nthe surface if applied to hot metal or are permitted to dry', '9.\t\nDaily draining of fuel cell sumps\n10.\t Daily wipe down of exposed critical areas\n11.\t Sealing of aircraft against water during foul weather \nand proper ventilation on warm, sunny days\n12.\t Replacing deteriorated or damaged gaskets and \nsealants to avoid water intrusion and/or entrapment\n13.\t Maximum use of protective covers on parked aircraft\nAfter any period where regular corrosion preventive \nmaintenance is interrupted, the amount of maintenance', 'an electrolyte and conduct a current. Physical factors, \nsuch as water temperature and velocity, also have a \ndirect bearing on its corrosiveness.\nPreventive Maintenance\nMuch has been done to improve the corrosion resistance \nof aircraft, such as improvements in materials, surface \ntreatments, insulation, and modern protective finishes. All of \nthese have been aimed at reducing the overall maintenance \neffort, as well as improving reliability. In spite of these']","Aircraft corrosion is treated and prevented through various methods, including cleaning, inspecting, and treating corrosion-prone areas more frequently than less prone areas (Corrosion Prone Areas, page not specified). Additionally, daily maintenance tasks such as draining fuel cell sumps, wiping down exposed critical areas, and sealing the aircraft against water are essential (items 9-12, page not specified). Polishing is also used to remove oxidation and corrosion, and it is crucial to follow the aircraft manufacturer's instructions for specific applications (Polishing, page not specified). Furthermore, the use of protective covers on parked aircraft and replacing deteriorated or damaged gaskets and sealants can help prevent water intrusion and corrosion (items 13 and 12, page not specified). It is also important to note that chemical cleaners must be used with care, and all residues must be removed to prevent corrosion (Chemical cleaners, page not specified).","Corrosion treatment involves removing affected material, applying chemical conversion coatings, and protecting surfaces with approved primers and topcoats.",,0.9892207607605698,
